{
  "spec_id": "SPEC-023",
  "contract_version": 1,
  "status": "needs_design",
  "thread_id": "impl-terra-023",
  "runtime": { "classification": "normal_implementation", "model": "gpt-5.6-terra", "reasoning": "medium" },
  "changed_files": ["src/sensor-export.mjs", "tests/sensor-export.test.mjs"],
  "artifacts": [],
  "acceptance_evidence": {},
  "validation_evidence": {},
  "deviations": [],
  "unresolved_items": ["Equal timestamp ordering is not specified."],
  "needs_design": {
    "question": "How must samples with equal timestamps be ordered?",
    "reason": "The public JSON order changes observable output and no durable source defines a tie-breaker.",
    "impact": "Export stability and AC-001 fixtures.",
    "affected_areas": ["serializer", "fixtures", "public contract"],
    "alternatives": ["preserve input order", "sort by normalized value", "introduce a stable sample ID"]
  },
  "usage": { "input_tokens": 8200, "cached_input_tokens": 1200, "cache_write_input_tokens": 0, "output_tokens": 900, "reasoning_output_tokens": 300 }
}
